{"candidate":{"candidateId":"fixture-candidate","lineageRootSha":"aaaaaaaaaaaaaaaaaaaaaaaaaaaaaaaaaaaaaaaa","releaseRef":"rc/fixture","repositoryId":"fixture-repo","sourceSha":"aaaaaaaaaaaaaaaaaaaaaaaaaaaaaaaaaaaaaaaa"},"edges":[{"condition":"success","from":"fixture-build","reason":"fixture","to":"fixture-discover"},{"condition":"success","from":"fixture-discover","reason":"fixture","to":"fixture-selection"}],"history":{"closedAtUtc":null,"digest":null,"fallbackReason":"fixture","sourceRunId":null},"mode":"Full","nodes":[{"action":"fixture.build","canonicalOrdinal":0,"chunk":null,"coverageRole":"required","disposition":"execute","estimate":{"basis":"provisional","p95Seconds":null,"samples":0,"seconds":1.25,"stratum":null,"timingDigest":null},"id":"fixture-build","inputFingerprint":null,"kind":"build","laneId":"fixture-lane","platformOfRecord":"Windows","priority":{"class":"prerequisite","lastCompletedAtUtc":null,"rank":0,"reason":"fixture"},"project":"tests/Fixture/Fixture.csproj","requires":{"hostLabel":"fixture-host","liveProvider":null,"needsNativeLock":false,"platform":"Any"},"selection":{"expectedCount":0,"filter":null,"uidSetDigest":null},"skipReceipt":null,"suite":"fixture","targetId":"windows-B"},{"action":"fixture.chunk","canonicalOrdinal":3,"chunk":null,"coverageRole":"required","disposition":"execute","estimate":{"basis":"provisional","p95Seconds":null,"samples":0,"seconds":1.25,"stratum":null,"timingDigest":null},"id":"fixture-selection","inputFingerprint":null,"kind":"chunk","laneId":"fixture-lane","platformOfRecord":"Windows","priority":{"class":"prerequisite","lastCompletedAtUtc":null,"rank":3,"reason":"fixture"},"project":"tests/Fixture/Fixture.csproj","requires":{"hostLabel":"fixture-host","liveProvider":null,"needsNativeLock":false,"platform":"Any"},"selection":{"expectedCount":2,"filter":"/*/Fixture/*/*","uidSetDigest":"29afb3ce875aa830333611c8d17ed6a95dc2cf925e1288e88a3e44fbb4bab9b2"},"skipReceipt":null,"suite":"fixture","targetId":"windows-B"},{"action":"fixture.discover","canonicalOrdinal":1,"chunk":null,"coverageRole":"required","disposition":"execute","estimate":{"basis":"provisional","p95Seconds":null,"samples":0,"seconds":1.25,"stratum":null,"timingDigest":null},"id":"fixture-discover","inputFingerprint":null,"kind":"discover","laneId":"fixture-lane","platformOfRecord":"Windows","priority":{"class":"prerequisite","lastCompletedAtUtc":null,"rank":1,"reason":"fixture"},"project":"tests/Fixture/Fixture.csproj","requires":{"hostLabel":"fixture-host","liveProvider":null,"needsNativeLock":false,"platform":"Any"},"selection":{"expectedCount":0,"filter":null,"uidSetDigest":null},"skipReceipt":null,"suite":"fixture","targetId":"windows-B"},{"action":"fixture.project","canonicalOrdinal":2,"chunk":null,"coverageRole":"required","disposition":"group","estimate":{"basis":"provisional","p95Seconds":null,"samples":0,"seconds":1.25,"stratum":null,"timingDigest":null},"id":"fixture-group","inputFingerprint":null,"kind":"project","laneId":"fixture-lane","platformOfRecord":"Windows","priority":{"class":"prerequisite","lastCompletedAtUtc":null,"rank":2,"reason":"fixture"},"project":"tests/Fixture/Fixture.csproj","requires":{"hostLabel":"fixture-host","liveProvider":null,"needsNativeLock":false,"platform":"Any"},"selection":{"expectedCount":0,"filter":null,"uidSetDigest":null},"skipReceipt":null,"suite":"fixture","targetId":"windows-B"},{"action":"fixture.selection","canonicalOrdinal":4,"chunk":null,"coverageRole":"diagnostic","disposition":"execute","estimate":{"basis":"provisional","p95Seconds":null,"samples":0,"seconds":1.25,"stratum":null,"timingDigest":null},"id":"fixture-diagnostic","inputFingerprint":null,"kind":"selection","laneId":"fixture-lane","platformOfRecord":"Windows","priority":{"class":"prerequisite","lastCompletedAtUtc":null,"rank":4,"reason":"fixture"},"project":"tests/Fixture/Fixture.csproj","requires":{"hostLabel":"fixture-host","liveProvider":null,"needsNativeLock":false,"platform":"Any"},"selection":{"expectedCount":2,"filter":"/*/Fixture/*/*","uidSetDigest":"29afb3ce875aa830333611c8d17ed6a95dc2cf925e1288e88a3e44fbb4bab9b2"},"skipReceipt":null,"suite":"fixture","targetId":"windows-B"}],"order":"Smart","phase":"execute","planner":{"kind":"deterministic","proposalDigest":null,"version":"1"},"policyDigest":"bbbbbbbbbbbbbbbbbbbbbbbbbbbbbbbbbbbbbbbbbbbbbbbbbbbbbbbbbbbbbbbb","preparationReceipt":"eeeeeeeeeeeeeeeeeeeeeeeeeeeeeeeeeeeeeeeeeeeeeeeeeeeeeeeeeeeeeeee","profile":"rc","rosterDigest":"cccccccccccccccccccccccccccccccccccccccccccccccccccccccccccccccc","runId":"fixture-run-A","schemaVersion":1,"targets":[{"bindingDigest":"ffffffffffffffffffffffffffffffffffffffffffffffffffffffffffffffff","capability":{"hostLabel":"fixture-host","liveProvider":null,"needsNativeLock":false,"platform":"Windows"},"id":"windows-B","parallelism":1,"quota":null,"resourceKeys":["fixture-db","fixture-lock"]}]}